[
  {
    "code": "snapshot",
    "name": "Snapshot",
    "cycles": ["lunar", "sansan", "mumbad", "flashpoint", "red_sand", "kitara"],
    "packs": ["cac", "hap", "oac", "td", "core2", "rar"]
  },
  {
    "code": "snapshot_plus",
    "name": "Snapshot+",
    "cycles": ["lunar", "sansan", "mumbad", "flashpoint", "red_sand", "kitara"],
    "packs": ["cac", "hap", "oac", "td", "core2", "rar", "mo"]
  }
]
